{
  "$schema": "https://json-schema.org/draft/2020-12/schema#",
  "$id": "resource:/schemas/crac/crac-v1.0.json",
  "description": "Contingency list, Remedial Actions and additional Constraints",
  "title": "CRAC",
  "type": "object",
  "properties": {
    "type": {
      "const": "CRAC"
    },
    "version": {
      "const": "1.0"
    },
    "info": {
      "description": "Information about the CRAC",
      "type": "string"
    },
    "id": {
      "description": "The unique identifier of the CRAC",
      "type": "string"
    },
    "name": {
      "description": "The name of the CRAC",
      "type": "string"
    },
    "networkElementsNamePerId": {
      "description": "A map of network element names indexed by their identifiers",
      "type": "object",
      "additionalProperties": {
        "type": "string"
      }
    },
    "contingencies": {
      "description": "The list of contingencies to be studied",
      "type": "array",
      "items": {
        "$ref": "../contingency/contingency-v1.0.json"
      }
    },
    "flowCnecs": {
      "description": "The list of flow CNECs to be monitored",
      "type": "array",
      "items": {
        "items": {
          "$ref": "../flow-cnec/flow-cnec-v1.0.json"
        }
      }
    },
    "pstRangeActions": {
      "description": "The list of PST range actions",
      "type": "array",
      "items": {
        "$ref": "../pst-range-action/pst-range-action-v1.0.json"
      }
    },
    "hvdcRangeActions": {
      "description": "The list of HVDC range actions",
      "type": "array",
      "items": {
        "$ref": "../hvdc-range-action/hvdc-range-action-v1.0.json"
      }
    },
    "networkActions": {
      "description": "The list of network actions",
      "type": "array",
      "items": {
        "$ref": "../network-action/network-action-v1.0.json"
      }
    },
    "extensions": {
      "type": "object",
      "additionalProperties": true
    }
  },
  "additionalProperties": false,
  "required": [
    "type",
    "version",
    "id",
    "name"
  ]
}
