{
  "type" : "CRAC",
  "version" : "1.0",
  "id": "LS_unsecure",
  "name": "LS_unsecure",
  "networkElementsNamePerId": { },
  "contingencies": [
    {
      "id": "N-1 NL1-NL3",
      "networkElementsIds": [
        "NNL1AA1  NNL2AA1  1"
      ]
    }
  ],
  "flowCnecs": [
    {
      "id": "Tieline BE FR - Defaut - N-1 NL1-NL3",
      "name": "Tieline BE FR",
      "networkElementId": "BBE2AA1  FFR3AA1  1",
      "operator" : "FR",
      "thresholds": [ {
        "unit": "megawatt",
        "max": 750,
        "min" : -750,
        "rule" : "onRightSide"
      } ],
      "contingencyId": "N-1 NL1-NL3",
      "instant" : "curative",
      "optimized": true,
      "nominalV" : [ 380.0 ]
    },
    {
      "id": "Tieline BE FR - N - preventive",
      "name": "Tieline BE FR",
      "networkElementId": "BBE2AA1  FFR3AA1  1",
      "operator" : "FR",
      "thresholds": [ {
        "unit": "megawatt",
        "max": 750,
        "min" : -750,
        "rule" : "onLeftSide"
      } ],
      "instant": "preventive",
      "optimized": true,
      "nominalV" : [ 380.0 ]
    }
  ],
  "pstRangeActions": [
    {
      "id": "PRA_PST_BE",
      "name": "PRA_PST_BE",
      "operator": "BE",
      "initialTap": 0,
      "speed": 1,
      "tapToAngleConversionMap" : {
        "-1" : -0.3896097993971608,
        "0" : 0.0,
        "-2" : -0.7792105912934298,
        "1" : 0.3896097993971608,
        "-3" : -1.1687933694373345,
        "2" : 0.7792105912934298,
        "-4" : -1.5583491300758083,
        "3" : 1.1687933694373345,
        "-5" : -1.9478688732023104,
        "4" : 1.5583491300758083,
        "-6" : -2.337343603803646,
        "5" : 1.9478688732023104,
        "-7" : -2.7267643331050597,
        "6" : 2.337343603803646,
        "-8" : -3.1161220798131644,
        "7" : 2.7267643331050597,
        "-9" : -3.505407871356285,
        "8" : 3.1161220798131644,
        "-10" : -3.894612745121778,
        "9" : 3.505407871356285,
        "-11" : -4.283727749689918,
        "10" : 3.894612745121778,
        "-12" : -4.672743946063913,
        "11" : 4.283727749689918,
        "-13" : -5.061652408895631,
        "12" : 4.672743946063913,
        "-14" : -5.4504442277066305,
        "13" : 5.061652408895631,
        "-15" : -5.839110508104064,
        "14" : 5.4504442277066305,
        "-16" : -6.2276423729910535,
        "15" : 5.839110508104064,
        "16" : 6.2276423729910535
      },
      "freeToUseUsageRules": [
        {
          "usageMethod": "available",
          "instant": "preventive"
        }
      ],
      "ranges": [
        {
          "min": -12,
          "max": 12,
          "rangeType": "absolute"
        }
      ],
      "networkElementId": "BBE2AA1  BBE3AA1  1"
    },
    {
      "id": "CRA_PST_BE",
      "name": "CRA_PST_BE",
      "operator": "BE",
      "initialTap": 0,
      "speed": 1,
      "tapToAngleConversionMap" : {
        "-1" : -0.3896097993971608,
        "0" : 0.0,
        "-2" : -0.7792105912934298,
        "1" : 0.3896097993971608,
        "-3" : -1.1687933694373345,
        "2" : 0.7792105912934298,
        "-4" : -1.5583491300758083,
        "3" : 1.1687933694373345,
        "-5" : -1.9478688732023104,
        "4" : 1.5583491300758083,
        "-6" : -2.337343603803646,
        "5" : 1.9478688732023104,
        "-7" : -2.7267643331050597,
        "6" : 2.337343603803646,
        "-8" : -3.1161220798131644,
        "7" : 2.7267643331050597,
        "-9" : -3.505407871356285,
        "8" : 3.1161220798131644,
        "-10" : -3.894612745121778,
        "9" : 3.505407871356285,
        "-11" : -4.283727749689918,
        "10" : 3.894612745121778,
        "-12" : -4.672743946063913,
        "11" : 4.283727749689918,
        "-13" : -5.061652408895631,
        "12" : 4.672743946063913,
        "-14" : -5.4504442277066305,
        "13" : 5.061652408895631,
        "-15" : -5.839110508104064,
        "14" : 5.4504442277066305,
        "-16" : -6.2276423729910535,
        "15" : 5.839110508104064,
        "16" : 6.2276423729910535
      },
      "onStateUsageRules" : [ {
        "instant" : "curative",
        "contingencyId" : "N-1 NL1-NL3",
        "usageMethod" : "available"
      } ],
      "ranges": [
        {
          "min": -15,
          "max": 15,
          "rangeType": "absolute"
        }
      ],
      "networkElementId": "BBE2AA1  BBE3AA1  1"
    }
  ],
  "networkActions": []
}