{
  "type" : "CRAC",
  "version" : "1.0",
  "id" : "LS_parade_pst_direct",
  "name" : "LS_parade_pst_direct",
  "networkElementsNamePerId": { },
  "contingencies" : [ {
    "id" : "Contingency 1",
    "networkElementsIds" : [ "FFR1AA1G FFR2AA1H 1" ]
  }, {
      "id" : "Contingency Interco",
      "networkElementsIds" : [ "FFR2AA1H DDE3AA1F 1" ]
    }],
  "flowCnecs" : [ {
    "id" : "FFR2AA1H DDE3AA1F 1 - Curatif - Contingency 1",
    "name" : "Tie-line FR DE",
    "networkElementId" : "FFR2AA1H DDE3AA1F 1",
    "contingencyId" : "Contingency 1",
    "instant": "curative",
    "frm" : 0.0,
    "nominalV" : [ 380.0 ],
    "thresholds" : [ {
      "unit" : "ampere",
      "rule" : "onLeftSide",
      "max" : 1500.0
    } ],
    "extensions" : {
      "CnecResultExtension" : {
        "resultsPerVariant" : {
          "preOptimisationResults-3788be4e-3998-4fe8-8d7d-e5088ab87edf" : {
            "type" : "cnec-result",
            "flowInMW" : 1451.9127197265625,
            "flowInA" : 2097.820556640625,
            "minThresholdInMW" : -Infinity,
            "maxThresholdInMW" : 1039.2304845413264,
            "minThresholdInA" : -Infinity,
            "maxThresholdInA" : 1500.0
          },
          "postOptimisationResults-5541441d-b49f-4670-bb70-d30e60c8ccaa" : {
            "type" : "cnec-result",
            "flowInMW" : 1286.8662109375,
            "flowInA" : 1858.9375,
            "minThresholdInMW" : -Infinity,
            "maxThresholdInMW" : 1039.2304845413264,
            "minThresholdInA" : -Infinity,
            "maxThresholdInA" : 1500.0
          }
        }
      }
    }
  }, {
    "id" : "DDE1AA1D DDE2AA1E 1 - Défaut - Contingency 1",
    "name" : "Line DE1 DE2",
    "networkElementId" : "DDE1AA1D DDE2AA1E 1",
    "contingencyId" : "Contingency 1",
    "instant": "outage",
    "frm" : -1.0,
    "nominalV" : [ 380.0 ],
    "thresholds" : [ {
      "unit" : "ampere",
      "rule" : "onLeftSide",
      "min" : -1500.0,
      "max" : 1500.0
    } ],
    "extensions" : {
      "CnecResultExtension" : {
        "resultsPerVariant" : {
          "preOptimisationResults-3788be4e-3998-4fe8-8d7d-e5088ab87edf" : {
            "type" : "cnec-result",
            "flowInMW" : -349.3979797363281,
            "flowInA" : -504.3426208496094,
            "minThresholdInMW" : -1039.2304845413264,
            "maxThresholdInMW" : 1039.2304845413264,
            "minThresholdInA" : -1500.0,
            "maxThresholdInA" : 1500.0
          },
          "postOptimisationResults-5541441d-b49f-4670-bb70-d30e60c8ccaa" : {
            "type" : "cnec-result",
            "flowInMW" : -404.3988952636719,
            "flowInA" : -583.7461547851562,
            "minThresholdInMW" : -1039.2304845413264,
            "maxThresholdInMW" : 1039.2304845413264,
            "minThresholdInA" : -1500.0,
            "maxThresholdInA" : 1500.0
          }
        }
      }
    }
  }, {
    "id" : "DDE1AA1D DDE2AA1E 1 - Curatif - Contingency 1",
    "name" : "Line DE1 DE2",
    "networkElementId" : "DDE1AA1D DDE2AA1E 1",
    "contingencyId" : "Contingency 1",
    "instant": "curative",
    "frm" : 2.0,
    "nominalV" : [ 380.0 ],
    "thresholds" : [ {
      "unit" : "ampere",
      "rule" : "onLeftSide",
      "min" : -1500.0,
      "max" : 1500.0
    } ],
    "extensions" : {
      "CnecResultExtension" : {
        "resultsPerVariant" : {
          "preOptimisationResults-3788be4e-3998-4fe8-8d7d-e5088ab87edf" : {
            "type" : "cnec-result",
            "flowInMW" : -349.3979797363281,
            "flowInA" : -504.3426208496094,
            "minThresholdInMW" : -1039.2304845413264,
            "maxThresholdInMW" : 1039.2304845413264,
            "minThresholdInA" : -1500.0,
            "maxThresholdInA" : 1500.0
          },
          "postOptimisationResults-5541441d-b49f-4670-bb70-d30e60c8ccaa" : {
            "type" : "cnec-result",
            "flowInMW" : -404.3988952636719,
            "flowInA" : -583.7461547851562,
            "minThresholdInMW" : -1039.2304845413264,
            "maxThresholdInMW" : 1039.2304845413264,
            "minThresholdInA" : -1500.0,
            "maxThresholdInA" : 1500.0
          }
        }
      }
    }
  }, {
    "id" : "DDE1AA1D DDE2AA1E 1 - N - preventive",
    "name" : "Line DE1 DE2",
    "networkElementId" : "DDE1AA1D DDE2AA1E 1",
    "instant" : "preventive",
    "frm" : 3.0,
    "nominalV" : [ 380.0 ],
    "thresholds" : [ {
      "unit" : "ampere",
      "rule" : "onLeftSide",
      "min" : -1500.0,
      "max" : 1500.0
    } ],
    "extensions" : {
      "CnecResultExtension" : {
        "resultsPerVariant" : {
          "preOptimisationResults-3788be4e-3998-4fe8-8d7d-e5088ab87edf" : {
            "type" : "cnec-result",
            "flowInMW" : -333.455078125,
            "flowInA" : -481.3270568847656,
            "minThresholdInMW" : -1039.2304845413264,
            "maxThresholdInMW" : 1039.2304845413264,
            "minThresholdInA" : -1500.0,
            "maxThresholdInA" : 1500.0
          },
          "postOptimisationResults-5541441d-b49f-4670-bb70-d30e60c8ccaa" : {
            "type" : "cnec-result",
            "flowInMW" : -391.2393493652344,
            "flowInA" : -564.74755859375,
            "minThresholdInMW" : -1039.2304845413264,
            "maxThresholdInMW" : 1039.2304845413264,
            "minThresholdInA" : -1500.0,
            "maxThresholdInA" : 1500.0
          }
        }
      }
    }
  }, {
    "id" : "FFR2AA1H DDE3AA1F 1 - Défaut - Contingency 1",
    "name" : "Tie-line FR DE",
    "networkElementId" : "FFR2AA1H DDE3AA1F 1",
    "contingencyId" : "Contingency 1",
    "instant": "outage",
    "frm" : 4.0,
    "nominalV" : [ 380.0 ],
    "thresholds" : [ {
      "unit" : "ampere",
      "rule" : "onLeftSide",
      "max" : 1500.0
    } ],
    "extensions" : {
      "CnecResultExtension" : {
        "resultsPerVariant" : {
          "preOptimisationResults-3788be4e-3998-4fe8-8d7d-e5088ab87edf" : {
            "type" : "cnec-result",
            "flowInMW" : 1451.9127197265625,
            "flowInA" : 2097.820556640625,
            "minThresholdInMW" : -Infinity,
            "maxThresholdInMW" : 1039.2304845413264,
            "minThresholdInA" : -Infinity,
            "maxThresholdInA" : 1500.0
          },
          "postOptimisationResults-5541441d-b49f-4670-bb70-d30e60c8ccaa" : {
            "type" : "cnec-result",
            "flowInMW" : 1286.8662109375,
            "flowInA" : 1858.9375,
            "minThresholdInMW" : -Infinity,
            "maxThresholdInMW" : 1039.2304845413264,
            "minThresholdInA" : -Infinity,
            "maxThresholdInA" : 1500.0
          }
        }
      }
    }
  }, {
    "id" : "FFR2AA1H DDE3AA1F 1 - N - preventive",
    "name" : "Tie-line FR DE",
    "networkElementId" : "FFR2AA1H DDE3AA1F 1",
    "instant" : "preventive",
    "frm" : 5.0,
    "nominalV" : [ 380.0 ],
    "thresholds" : [ {
      "unit" : "ampere",
      "rule" : "onLeftSide",
      "max" : 1500.0
    } ],
    "extensions" : {
      "CnecResultExtension" : {
        "resultsPerVariant" : {
          "preOptimisationResults-3788be4e-3998-4fe8-8d7d-e5088ab87edf" : {
            "type" : "cnec-result",
            "flowInMW" : 1499.7794189453125,
            "flowInA" : 2167.1318359375,
            "minThresholdInMW" : -Infinity,
            "maxThresholdInMW" : 1039.2304845413264,
            "minThresholdInA" : -Infinity,
            "maxThresholdInA" : 1500.0
          },
          "postOptimisationResults-5541441d-b49f-4670-bb70-d30e60c8ccaa" : {
            "type" : "cnec-result",
            "flowInMW" : 1326.383056640625,
            "flowInA" : 1916.11865234375,
            "minThresholdInMW" : -Infinity,
            "maxThresholdInMW" : 1039.2304845413264,
            "minThresholdInA" : -Infinity,
            "maxThresholdInA" : 1500.0
          }
        }
      }
    }
  } ],
  "pstRangeActions" : [ {
    "id" : "PST1",
    "name" : "PST1",
    "operator" : "FR",
    "initialTap": 0,
    "tapToAngleConversionMap" : {
      "-3" : 0.0,
      "-2" : 0.5,
      "-1" : 1.0,
      "0" : 1.5,
      "1" : 2.0,
      "2" : 2.5,
      "3" : 3.0
    },
    "freeToUseUsageRules" : [ {
      "usageMethod" : "available",
      "instant" : "preventive"
    } ],
    "networkElementId" : "BBE2AA1  BBE3AA1  1",
    "ranges" : [ {
      "min" : 1.0,
      "max" : 33.0,
      "rangeType" : "absolute"
    } ]
  } ],
  "networkActions" : [ {
    "id" : "complexNetworkActionId",
    "name" : "complexNetworkActionName",
    "operator" : "RTE",
    "freeToUseUsageRules" : [ {
      "instant" : "preventive",
      "usageMethod" : "available"
    } ],
    "topologicalActions" : [ {
      "networkElementId" : "FFR2AA1H DDE3AA1F 1",
      "actionType" : "close"
    } ],
    "pstSetpoints" : [ {
      "networkElementId" : "BBE2AA1  BBE3AA1  1",
      "setpoint" : 5
    } ],
    "extensions" : {

    }
  }],
  "extensions" : {
    "ResultVariantManager" : {
      "variantIds" : [ "preOptimisationResults-3788be4e-3998-4fe8-8d7d-e5088ab87edf", "postOptimisationResults-5541441d-b49f-4670-bb70-d30e60c8ccaa" ]
    },
    "CracResultExtension" : {
      "resultsPerVariant" : {
        "preOptimisationResults-3788be4e-3998-4fe8-8d7d-e5088ab87edf" : {
          "type" : "crac-result",
          "networkSecurityStatus" : "UNSECURED",
          "functionalCost" : 460.5489344039861,
          "virtualCost" : 0.0
        },
        "postOptimisationResults-5541441d-b49f-4670-bb70-d30e60c8ccaa" : {
          "type" : "crac-result",
          "networkSecurityStatus" : "UNSECURED",
          "functionalCost" : 287.1525720992986,
          "virtualCost" : 0.0
        }
      }
    }
  },
  "hvdcRangeActions": [ ]
}